{
  "meta": {
    "expansion": "Midnight",
    "patch": "12.1 / 12.1.5",
    "season_id": 18,
    "season_name": "Midnight Season 2",
    "schema_version": 1,
    "description": "Midnight Season 2 item level progression, upgrade tracks, crest requirements, and drop/vault rewards across all major endgame activities."
  },
  "crest_types": [
    {
      "id": "adventurer",
      "name": "Weathered Crest",
      "color": "quality-uncommon",
      "source": "World Quests, Delves Tier 1-3, Heroic Dungeons"
    },
    {
      "id": "veteran",
      "name": "Carved Crest",
      "color": "quality-rare",
      "source": "Delves Tier 4-7, Mythic 0 Dungeons, Raid Finder"
    },
    {
      "id": "champion",
      "name": "Runed Crest",
      "color": "quality-epic",
      "source": "Mythic+ +2 to +7, Normal Raids, Delves Tier 8+"
    },
    {
      "id": "hero",
      "name": "Gilded / Hero Crest",
      "color": "quality-epic",
      "source": "Mythic+ +8 to +10+, Heroic Raids"
    },
    {
      "id": "myth",
      "name": "Myth Crest",
      "color": "quality-legendary",
      "source": "Mythic+ +10+, Mythic Raids, Rated PvP"
    }
  ],
  "tracks": [
    {
      "id": "adventurer",
      "name": "Adventurer",
      "badge": "ADV",
      "color": "#ffffff",
      "ranks": 8,
      "crest": "adventurer",
      "steps": [
        { "rank": 1, "ilvl": 266 },
        { "rank": 2, "ilvl": 269 },
        { "rank": 3, "ilvl": 272 },
        { "rank": 4, "ilvl": 276 },
        { "rank": 5, "ilvl": 279 },
        { "rank": 6, "ilvl": 282 },
        { "rank": 7, "ilvl": 285 },
        { "rank": 8, "ilvl": 289 }
      ]
    },
    {
      "id": "veteran",
      "name": "Veteran",
      "badge": "VET",
      "color": "#1eff00",
      "ranks": 8,
      "crest": "veteran",
      "steps": [
        { "rank": 1, "ilvl": 279 },
        { "rank": 2, "ilvl": 282 },
        { "rank": 3, "ilvl": 285 },
        { "rank": 4, "ilvl": 289 },
        { "rank": 5, "ilvl": 292 },
        { "rank": 6, "ilvl": 295 },
        { "rank": 7, "ilvl": 298 },
        { "rank": 8, "ilvl": 302 }
      ]
    },
    {
      "id": "champion",
      "name": "Champion",
      "badge": "CHA",
      "color": "#0070dd",
      "ranks": 8,
      "crest": "champion",
      "steps": [
        { "rank": 1, "ilvl": 292 },
        { "rank": 2, "ilvl": 295 },
        { "rank": 3, "ilvl": 298 },
        { "rank": 4, "ilvl": 302 },
        { "rank": 5, "ilvl": 305 },
        { "rank": 6, "ilvl": 308 },
        { "rank": 7, "ilvl": 311 },
        { "rank": 8, "ilvl": 315 }
      ]
    },
    {
      "id": "hero",
      "name": "Hero",
      "badge": "HER",
      "color": "#a335ee",
      "ranks": 6,
      "crest": "hero",
      "steps": [
        { "rank": 1, "ilvl": 305 },
        { "rank": 2, "ilvl": 308 },
        { "rank": 3, "ilvl": 311 },
        { "rank": 4, "ilvl": 315 },
        { "rank": 5, "ilvl": 318 },
        { "rank": 6, "ilvl": 321 }
      ]
    },
    {
      "id": "myth",
      "name": "Myth",
      "badge": "MYT",
      "color": "#ff8000",
      "ranks": 6,
      "crest": "myth",
      "steps": [
        { "rank": 1, "ilvl": 318 },
        { "rank": 2, "ilvl": 321 },
        { "rank": 3, "ilvl": 324 },
        { "rank": 4, "ilvl": 328 },
        { "rank": 5, "ilvl": 331 },
        { "rank": 6, "ilvl": 334 }
      ]
    }
  ],
  "activities": {
    "mythic_plus": [
      {
        "level": "Heroic Dungeon",
        "drop_ilvl": 276,
        "drop_track": "Adventurer 4/8",
        "vault_ilvl": 289,
        "vault_track": "Veteran 4/8",
        "crests": "Weathered Crests"
      },
      {
        "level": "Mythic 0 (M0)",
        "drop_ilvl": 292,
        "drop_track": "Champion 1/8",
        "vault_ilvl": 302,
        "vault_track": "Champion 4/8",
        "crests": "Carved Crests"
      },
      {
        "level": "+2 - +3",
        "drop_ilvl": 295,
        "drop_track": "Champion 2/8",
        "vault_ilvl": 305,
        "vault_track": "Hero 1/6",
        "crests": "Runed Crests"
      },
      {
        "level": "+4",
        "drop_ilvl": 298,
        "drop_track": "Champion 3/8",
        "vault_ilvl": 308,
        "vault_track": "Hero 2/6",
        "crests": "Runed Crests"
      },
      {
        "level": "+5",
        "drop_ilvl": 302,
        "drop_track": "Champion 4/8",
        "vault_ilvl": 308,
        "vault_track": "Hero 2/6",
        "crests": "Runed Crests"
      },
      {
        "level": "+6",
        "drop_ilvl": 305,
        "drop_track": "Hero 1/6",
        "vault_ilvl": 311,
        "vault_track": "Hero 3/6",
        "crests": "Runed Crests"
      },
      {
        "level": "+7",
        "drop_ilvl": 305,
        "drop_track": "Hero 1/6",
        "vault_ilvl": 315,
        "vault_track": "Hero 4/6",
        "crests": "Runed Crests"
      },
      {
        "level": "+8 - +9",
        "drop_ilvl": 308,
        "drop_track": "Hero 2/6",
        "vault_ilvl": 315,
        "vault_track": "Hero 4/6",
        "crests": "Gilded / Hero Crests"
      },
      {
        "level": "+10+",
        "drop_ilvl": 311,
        "drop_track": "Hero 3/6",
        "vault_ilvl": 318,
        "vault_track": "Myth 1/6",
        "crests": "Gilded / Hero Crests"
      }
    ],
    "delves": [
      {
        "tier": "Tier 1",
        "coffer_ilvl": 266,
        "coffer_track": "Adventurer 1/8",
        "trove_ilvl": null,
        "trove_track": null,
        "vault_ilvl": 279,
        "vault_track": "Veteran 1/8",
        "notes": "Introductory delve"
      },
      {
        "tier": "Tier 2",
        "coffer_ilvl": 269,
        "coffer_track": "Adventurer 2/8",
        "trove_ilvl": null,
        "trove_track": null,
        "vault_ilvl": 282,
        "vault_track": "Veteran 2/8",
        "notes": "Standard delve"
      },
      {
        "tier": "Tier 3",
        "coffer_ilvl": 272,
        "coffer_track": "Adventurer 3/8",
        "trove_ilvl": null,
        "trove_track": null,
        "vault_ilvl": 285,
        "vault_track": "Veteran 3/8",
        "notes": "Adventurer upgrade milestone"
      },
      {
        "tier": "Tier 4",
        "coffer_ilvl": 276,
        "coffer_track": "Adventurer 4/8",
        "trove_ilvl": 282,
        "trove_track": "Veteran 2/8",
        "vault_ilvl": 289,
        "vault_track": "Veteran 4/8",
        "notes": "First tier with Trovehunter Bounty"
      },
      {
        "tier": "Tier 5",
        "coffer_ilvl": 279,
        "coffer_track": "Veteran 1/8",
        "trove_ilvl": 289,
        "trove_track": "Veteran 4/8",
        "vault_ilvl": 292,
        "vault_track": "Champion 1/8",
        "notes": "Hard delve difficulty"
      },
      {
        "tier": "Tier 6",
        "coffer_ilvl": 282,
        "coffer_track": "Veteran 2/8",
        "trove_ilvl": 292,
        "trove_track": "Champion 1/8",
        "vault_ilvl": 298,
        "vault_track": "Champion 3/8",
        "notes": "Champion Great Vault rewards"
      },
      {
        "tier": "Tier 7",
        "coffer_ilvl": 292,
        "coffer_track": "Champion 1/8",
        "trove_ilvl": 295,
        "trove_track": "Champion 2/8",
        "vault_ilvl": 302,
        "vault_track": "Champion 4/8",
        "notes": "High coffer loot tier"
      },
      {
        "tier": "Tier 8 - 11",
        "coffer_ilvl": 295,
        "coffer_track": "Champion 2/8",
        "trove_ilvl": 305,
        "trove_track": "Hero 1/6",
        "vault_ilvl": 305,
        "vault_track": "Hero 1/6",
        "notes": "Maximum Delve Great Vault reward (Hero 1/6); Tier 11 Journey 9 drops Tormented Soul (305)"
      }
    ],
    "raids": [
      {
        "difficulty": "Raid Finder (LFR)",
        "boss_drops_ilvl": 279,
        "boss_drops_track": "Veteran 1/8",
        "rare_drops_ilvl": 285,
        "rare_drops_track": "Veteran 3/8 (Kith'ix / Rare)",
        "vault_ilvl": 292,
        "vault_track": "Champion 1/8",
        "crests": "Weathered & Carved Crests"
      },
      {
        "difficulty": "Normal",
        "boss_drops_ilvl": 292,
        "boss_drops_track": "Champion 1/8",
        "rare_drops_ilvl": 298,
        "rare_drops_track": "Champion 3/8 (Kith'ix / Rare)",
        "vault_ilvl": 305,
        "vault_track": "Hero 1/6",
        "crests": "Carved & Runed Crests"
      },
      {
        "difficulty": "Heroic",
        "boss_drops_ilvl": 305,
        "boss_drops_track": "Hero 1/6",
        "rare_drops_ilvl": 311,
        "rare_drops_track": "Hero 3/6 (Kith'ix / Rare)",
        "vault_ilvl": 318,
        "vault_track": "Myth 1/6",
        "crests": "Runed & Hero Crests"
      },
      {
        "difficulty": "Mythic",
        "boss_drops_ilvl": 318,
        "boss_drops_track": "Myth 1/6",
        "rare_drops_ilvl": 344,
        "rare_drops_track": "Mythic Last Bosses / Kith'ix",
        "vault_ilvl": 334,
        "vault_track": "Myth 6/6 (Standard) / 344 (Rare)",
        "crests": "Hero & Myth Crests"
      }
    ],
    "crafting": [
      {
        "name": "Base Blue + Adventurer Crests",
        "ilvl": 266,
        "track": "Adventurer 1/8",
        "crest_required": "80 Weathered Crests",
        "notes": "Starter crafted gear"
      },
      {
        "name": "Base Blue + Veteran Crests",
        "ilvl": 282,
        "track": "Veteran 2/8",
        "crest_required": "80 Carved Crests",
        "notes": "Intermediate crafted gear"
      },
      {
        "name": "Spark of Tides (Base Crafted)",
        "ilvl": 295,
        "track": "Champion 2/8",
        "crest_required": "Spark of Tides",
        "notes": "Season 2 primary crafted foundation"
      },
      {
        "name": "Spark + 80 Hero Crests",
        "ilvl": 308,
        "track": "Hero 2/6",
        "crest_required": "80 Gilded / Hero Crests",
        "notes": "Heroic-equivalent crafted gear"
      },
      {
        "name": "Spark + 80 Myth Crests",
        "ilvl": 321,
        "track": "Myth 2/6",
        "crest_required": "80 Myth Crests",
        "notes": "Mythic-equivalent crafted gear"
      },
      {